{
  "topic_candidates": [
    {
      "topic": "The Silent Thief: How Holding Cash Makes You Poorer (Inflation & Exchange Rates Explained)",
      "scores": {
        "audience_fit": 4,
        "novelty": 3,
        "monetization_potential": 4,
        "evidence_availability": 5,
        "production_feasibility": 5,
        "viral_potential": 8
      },
      "total_score": 29,
      "notes": "Strong, alarming title that directly addresses core research points about how inflation and exchange rates erode purchasing power. Offers a good balance of explaining complex economic concepts in an accessible manner."
    },
    {
      "topic": "Cash vs. Crisis: When to Hold & When to Invest (Emergency Funds vs. Inflation)",
      "scores": {
        "audience_fit": 5,
        "novelty": 4,
        "monetization_potential": 4,
        "evidence_availability": 5,
        "production_feasibility": 5,
        "viral_potential": 7
      },
      "total_score": 30,
      "notes": "Addresses the essential contrarian angle by balancing the risks of inflation with the crucial necessity of an emergency fund. This provides practical, balanced, and highly actionable advice for viewers facing a common financial dilemma."
    },
    {
      "topic": "Beyond Your Bank Account: Protecting Your Money from Invisible Threats (Inflation & Currency Risk)",
      "scores": {
        "audience_fit": 4,
        "novelty": 3,
        "monetization_potential": 4,
        "evidence_availability": 5,
        "production_feasibility": 5,
        "viral_potential": 6
      },
      "total_score": 27,
      "notes": "An intriguing title, but it's less direct and urgent compared to other options. While it covers the same core concepts, the hook for immediate audience engagement and viral spread is slightly weaker."
    },
    {
      "topic": "Why Your 'Safe' Savings Account is Actually Shrinking Your Wealth (A Deep Dive into Purchasing Power)",
      "scores": {
        "audience_fit": 5,
        "novelty": 4,
        "monetization_potential": 4,
        "evidence_availability": 5,
        "production_feasibility": 5,
        "viral_potential": 9
      },
      "total_score": 32,
      "notes": "Features an extremely strong, contrarian hook that directly challenges a common belief about the safety of savings. It is highly relatable and promises a deep dive into a personally impactful financial issue, making it very compelling."
    }
  ],
  "topic": "Why Your 'Safe' Savings Account is Actually Shrinking Your Wealth (A Deep Dive into Purchasing Power)",
  "target_audience": "Individuals with limited to intermediate financial literacy who primarily hold savings in traditional bank accounts. They are financially curious, aware of the need to manage their money effectively, and are seeking clear, actionable insights to protect and grow their wealth against economic forces like inflation.",
  "business_goal": "To significantly increase audience engagement and channel growth by providing counter-intuitive yet vital financial education. The goal is to establish the channel's authority as an insightful finance explainer and to drive traffic towards recommended financial tools or educational resources that offer solutions to the discussed problems.",
  "monetization_angle": "Opportunities for affiliate partnerships with high-yield savings accounts, money market funds, inflation-protected investment platforms (e.g., TIPS, I-Bonds), or diversified wealth management services. Potential for sponsored content from financial institutions that offer better alternatives to traditional low-interest savings.",
  "retention_hypothesis": "Viewers will maintain high engagement due to the compelling, counter-intuitive premise that directly challenges their perception of a 'safe' savings account. The content will offer clear, simplified explanations of complex economic concepts (inflation, purchasing power erosion) and provide actionable strategies to mitigate these risks, thus delivering practical value and fostering trust in the channel's expertise.",
  "content_constraints": [
    "Must simplify complex economic theories (like inflation mechanics and purchasing power) without oversimplifying or being misleading.",
    "Visualizations (e.g., charts, graphs, historical data comparisons) are crucial to illustrate the tangible impact of inflation on savings over time.",
    "The narrative needs to strike a careful balance between warning against excessive cash holdings and emphasizing the essential role of an appropriate emergency fund for financial security."
  ],
  "research_requirements": [
    "Gather recent historical inflation data (Consumer Price Index) for major currencies (e.g., USD, EUR) to quantify real-world purchasing power erosion.",
    "Analyze typical interest rates offered by various 'safe' savings vehicles (traditional savings accounts, high-yield savings, money market accounts) and compare them against historical and current inflation rates.",
    "Investigate and present best practices for determining and maintaining an appropriate emergency fund size, including different methodologies.",
    "Research current economic forecasts regarding inflation and interest rate trends to provide forward-looking context."
  ],
  "benchmark_insights": {
    "title_hooks": "Successful finance channels, such as Graham Stephan and others, consistently utilize 'myth-busting' or counter-intuitive titles that directly challenge common financial beliefs or reveal overlooked dangers. Titles that highlight a problem with something widely perceived as 'safe' (e.g., 'Why Your Safe Savings Account is Actually Shrinking Your Wealth') generate high click-through rates by immediately provoking curiosity and a desire for an explanation. This approach directly validates the high viral potential score assigned to the selected topic, aligning with proven engagement strategies in the financial content space.",
    "retention_graphs": "Videos with strong viewer retention typically feature an engaging opening hook, a clear articulation of the problem, and a systematic breakdown of solutions, supported by relatable examples and actionable steps. For this topic, illustrating the erosion of purchasing power with tangible examples and subsequently offering specific, practical alternatives and protective strategies will be crucial for maintaining viewer engagement throughout the entire video's duration."
  },
  "selection_rationale": "The topic 'Why Your 'Safe' Savings Account is Actually Shrinking Your Wealth (A Deep Dive into Purchasing Power)' was selected due to its highest total score, which is significantly bolstered by its exceptional viral potential (9/10) and strong audience fit. This topic employs a powerful, counter-intuitive hook that directly challenges a deeply ingrained belief held by many individuals: that money held in a savings account is inherently 'safe.' This compelling premise immediately generates intrigue and a strong motivation for viewers to understand why their perceived financial security might actually be detrimental to their long-term wealth. This type of 'myth-busting' content, which exposes an overlooked truth with significant personal financial impact, consistently performs exceedingly well on finance education channels, directly mirroring the highly effective title hooks observed in benchmark channels like Graham Stephan. The high viral potential is justified by its ability to tap into common financial anxieties and offer a revealing explanation. Furthermore, this topic offers substantial educational value, aligning perfectly with the 'insightful finance explainer' persona by providing crucial, actionable insights into wealth preservation in an inflationary economic environment.",
  "schema_version": "1.0"
}